{
  "discipline": "tdd-agent-required",
  "mechanism": "precedent",
  "scope": {
    "source": "target.path",
    "include": ["(apps|packages)/[^/]+/src/.*\\.(ts|tsx)$", "apps/pipeline/(ml/.*|api)\\.py$"],
    "exclude": [
      "\\.(test|spec)\\.(ts|tsx)$",
      "\\.d\\.ts$",
      "(__tests__|_lib)/",
      "\\.(expo|next|stryker-tmp|dist|build|venv)/",
      "apps/pipeline/conftest\\.py$"
    ]
  },
  "sources": {
    "transcript": {
      "transcript": true
    },
    "sidecar": {
      "sidecar": true
    }
  },
  "supply": {
    "transcript": "pass",
    "sidecar": "error"
  },
  "extract": {
    "writerToolUses": [
      {
        "op": "source",
        "of": "transcript"
      },
      {
        "op": "toolUses",
        "names": ["Agent", "Task"],
        "subagentType": "tdd-test-writer"
      }
    ],
    "writerSidecars": [
      {
        "op": "source",
        "of": "sidecar"
      },
      {
        "op": "json"
      },
      {
        "op": "agentType",
        "is": "tdd-test-writer"
      }
    ],
    "writerEvidence": [
      {
        "op": "union",
        "of": ["writerToolUses", "writerSidecars"]
      }
    ]
  },
  "relate": [
    {
      "id": "writer-precedent",
      "relation": {
        "op": "nonEmpty",
        "of": "writerEvidence"
      },
      "message": "production source edit without a tdd-test-writer subagent invocation in this session"
    }
  ],
  "witness": {
    "extract": {
      "skipAgeMs": [
        {
          "op": "source",
          "of": "transcript"
        },
        {
          "op": "userTexts",
          "re": "/tdd\\s+skip\\b",
          "i": true
        },
        {
          "op": "first"
        },
        {
          "op": "ageMs"
        },
        {
          "op": "filter",
          "when": [
            {
              "field": "ageMs",
              "lte": 600000
            }
          ]
        }
      ]
    },
    "relate": [
      {
        "id": "skip-recent",
        "relation": {
          "op": "nonEmpty",
          "of": "skipAgeMs"
        },
        "message": "a /tdd skip utterance within the last ten minutes opens the body's relations"
      }
    ]
  }
}
