{
  "discipline": "i18n-key-parity",
  "mechanism": "pairing",
  "sources": {
    "ko": {
      "file": "locales/ko.json"
    },
    "en": {
      "file": "locales/en.json"
    }
  },
  "supply": {
    "ko": "error",
    "en": "error"
  },
  "extract": {
    "koKeys": [
      {
        "op": "source",
        "of": "ko"
      },
      {
        "op": "json",
        "as": "ko"
      },
      {
        "op": "flattenKeys"
      },
      {
        "op": "sort"
      }
    ],
    "enKeys": [
      {
        "op": "source",
        "of": "en"
      },
      {
        "op": "json",
        "as": "en"
      },
      {
        "op": "flattenKeys"
      },
      {
        "op": "sort"
      }
    ]
  },
  "relate": [
    {
      "id": "key-parity",
      "relation": {
        "op": "equal",
        "of": ["koKeys", "enKeys"]
      },
      "messageBySide": {
        "left": "en.json — missing key '{value}' (present in ko.json)",
        "right": "ko.json — missing key '{value}' (present in en.json)"
      }
    }
  ]
}
